{"schemaVersion":1,"generatedAt":1722743000001,"meshRevision":null,"hosts":[{"hostId":"local","display":"local","local":true,"status":"ok","observedAt":1722743000001,"nativeHostname":"local.example","serverGeneration":"tmux-v1:1722741000:1234:/run/user/1000/tmux-1000/default","route":null,"sessions":[]}]}
