{"schemaVersion":1,"generatedAt":1722743000002,"meshRevision":null,"hosts":[{"hostId":"local","display":"local","local":true,"status":"ok","observedAt":1722743000002,"nativeHostname":"local.example","serverGeneration":"tmux-v1:1722741000:1234:/run/user/1000/tmux-1000/default","route":null,"sessions":[{"hostId":"local","serverGeneration":"tmux-v1:1722741000:1234:/run/user/1000/tmux-1000/default","sessionId":"$0","createdAt":1722742000,"name":"first","activityAt":1722742001,"lastAttachedAt":null,"attachedClients":0,"pending":false,"windowCount":1,"sessionPath":"/home/user","currentWindow":"shell","currentPath":"/home/user"},{"hostId":"local","serverGeneration":"tmux-v1:1722741000:1234:/run/user/1000/tmux-1000/default","sessionId":"$1","createdAt":1722742002,"name":"second","activityAt":1722742003,"lastAttachedAt":1722742003,"attachedClients":1,"pending":false,"windowCount":2,"sessionPath":"/home/user/code","currentWindow":"editor","currentPath":"/home/user/code"}]}]}
