{
  "schemaVersion": 1,
  "generatedAt": 1722743000123,
  "meshRevision": "sha256:0000000000000000000000000000000000000000000000000000000000000000",
  "viewerEndpoint": {"hostId": "local", "observedAt": 1722743000123},
  "hosts": [
    {
      "hostId": "local",
      "display": "Local",
      "local": true,
      "status": "ok",
      "observedAt": 1722743000123,
      "nativeHostname": "local.example",
      "serverGeneration": "tmux-v1:1722741000:1234:/run/user/1000/tmux/default",
      "route": null,
      "sessions": [
        {
          "hostId": "local",
          "serverGeneration": "tmux-v1:1722741000:1234:/run/user/1000/tmux/default",
          "sessionId": "$0",
          "createdAt": 1722742000,
          "name": "alpha",
          "activityAt": 1722742001,
          "lastAttachedAt": null,
          "attachedClients": 1,
          "pending": false,
          "windowCount": 1,
          "sessionPath": "/home/user",
          "currentWindow": "shell",
          "currentPath": "/home/user",
          "localViewer": {"state": "none"}
        },
        {
          "hostId": "local",
          "serverGeneration": "tmux-v1:1722741000:1234:/run/user/1000/tmux/default",
          "sessionId": "$1",
          "createdAt": 1722742002,
          "name": "beta",
          "activityAt": 1722742003,
          "lastAttachedAt": 1722742003,
          "attachedClients": 0,
          "pending": false,
          "windowCount": 1,
          "sessionPath": "/home/user/code",
          "currentWindow": "editor",
          "currentPath": "/home/user/code",
          "localViewer": {"state": "open", "confidence": "confirmed"}
        },
        {
          "hostId": "local",
          "serverGeneration": "tmux-v1:1722741000:1234:/run/user/1000/tmux/default",
          "sessionId": "$2",
          "createdAt": 1722742004,
          "name": "gamma",
          "activityAt": 1722742005,
          "lastAttachedAt": null,
          "attachedClients": 0,
          "pending": false,
          "windowCount": 1,
          "sessionPath": "/home/user/code",
          "currentWindow": "shell",
          "currentPath": "/home/user/code",
          "localViewer": {"state": "unknown", "reason": "compositor_unavailable"}
        }
      ]
    },
    {
      "hostId": "starship",
      "display": "Starship",
      "local": false,
      "status": "ok",
      "observedAt": 1722743000123,
      "nativeHostname": "starship.example",
      "serverGeneration": "tmux-v1:1722742000:4321:/tmp/tmux/default",
      "route": "starship",
      "sessions": [
        {
          "hostId": "starship",
          "serverGeneration": "tmux-v1:1722742000:4321:/tmp/tmux/default",
          "sessionId": "$7",
          "createdAt": 1722742100,
          "name": "remote-agent",
          "activityAt": 1722742101,
          "lastAttachedAt": null,
          "attachedClients": 2,
          "pending": false,
          "windowCount": 1,
          "sessionPath": "/home/user/code",
          "currentWindow": "agent",
          "currentPath": "/home/user/code",
          "localViewer": {"state": "open", "confidence": "matched"}
        }
      ]
    }
  ]
}
