{"schemaVersion":1,"generatedAt":1722743000004,"meshRevision":"sha256:aaaaaaaaaaaaaaaaaaaaaaaaaaaaaaaaaaaaaaaaaaaaaaaaaaaaaaaaaaaaaaaa","hosts":[{"hostId":"local","display":"Local","local":true,"status":"ok","observedAt":1722743000004,"nativeHostname":"local.example","serverGeneration":null,"route":null,"sessions":[]},{"hostId":"beta","display":"Beta","local":false,"status":"unreachable","observedAt":1722743000004,"nativeHostname":null,"serverGeneration":null,"route":null,"sessions":[],"error":{"code":"host_unreachable","message":"no configured route reached the host"}}]}
